{
  "schema": "om.evidence/v2",
  "id": "OM2-2.4.0-RC1-FREEZE",
  "kind": "candidate_freeze",
  "subject": {
    "identity": "OM2-2.4.0-RC1",
    "locator": "https://github.com/ro-pecha-labs/ai-assisted-development-operating-model/releases/tag/om-v2.4.0-rc1",
    "revision": {
      "kind": "git_commit",
      "value": "9ec7f6a8584b04e6d3483ceb5e7c875be7cf66a8"
    }
  },
  "outcome": "PASS",
  "summary": "RC1 freeze PASS. Annotated tag om-v2.4.0-rc1 (tag object d95a680246b0103ea220953a227998a47b03e14e, tagged 2026-10-14T10:03:19Z, unsigned) was read back from GitHub and resolves to exact commit 9ec7f6a8584b04e6d3483ceb5e7c875be7cf66a8 (merge of PR #67 into release/om-2.4). Tag-triggered Validate OM2 run 38546881825 (event push, ref om-v2.4.0-rc1) completed SUCCESS on that commit. tools/release_identity_guard.py PASS (expected = observed). GitHub Release OM 2.4.0 RC1 was read back as published (prerelease true, draft false, published 2026-10-14T10:05:40Z); the latest release is unchanged (om-v2.2.0). Individual ruleset clauses were not verified in this record."
}
