{
  "schema": "om.evidence/v2",
  "id": "OM2-2.0.0-RC2-QUALIFICATION",
  "kind": "candidate_qualification",
  "subject": {
    "identity": "OM2-2.0.0-RC2",
    "locator": "https://github.com/ro-pecha-labs/ai-assisted-development-operating-model/releases/tag/om-v2.0.0-rc2",
    "revision": {
      "kind": "git_commit",
      "value": "c5eee28bd8c8765824ac7f699be828018b92f5fb"
    }
  },
  "outcome": "PASS",
  "execution": {
    "provider": "github",
    "run_id": "35526350361",
    "run_url": "https://github.com/ro-pecha-labs/ai-assisted-development-operating-model/actions/runs/35526350361"
  },
  "summary": "RC2 qualification PASS. Candidate had pre-freeze cross-profile qualification across DEV, SOLUTION, DOCUMENT, EXPERIMENT and LIGHT, DEV evidence-parity regression qualification, protected-main hosted validation, immutable tag freeze, and successful tag-triggered hosted validation on the exact candidate SHA."
}
